ConseilID,Titre,Categorie,Contenu,Public
CO00117,Stockez votre véhicule hors d'eau pendant les intempéries,Sécurité,Les intempéries peuvent endommager votre véhicule. Stockez-le en lieu sûr. Ce conseil est validé par nos experts sécurité.,Seniors
CO00118,Déclarez les modifications de la carte grise,Administratif,Toute modification du véhicule doit être déclarée sur la carte grise. Ce conseil est validé par nos experts administratifs.,Professionnels
CO00119,Souscrivez une garantie pour les dommages causés par les intempéries,Souscription,Les intempéries comme la grêle peuvent endommager votre véhicule. Une garantie spécifique est utile. Ce conseil est validé par nos experts souscription.,Jeunes conducteurs
CO00120,Vérifiez les options de paiement de votre prime,Économie,Le paiement annuel est souvent moins cher que le paiement mensuel. Ce conseil est validé par nos experts économie.,Tous
CO00121,Utilisez une protection contre le vol pour les roues,Sécurité,Le vol des roues est fréquent. Une protection spécifique peut les sécuriser. Ce conseil est validé par nos experts sécurité.,Professionnels
CO00122,Consultez un expert avant de signer un contrat,Souscription,Un expert en assurance peut vous aider à choisir la meilleure offre. Ce conseil est validé par nos experts souscription.,Jeunes conducteurs
CO00123,Gardez une preuve de l'état du véhicule avant un sinistre,Sinistre,Des photos de votre véhicule peuvent prouver son état avant un sinistre. Ce conseil est validé par nos experts sinistres.,Seniors
CO00124,Négociez une clause de non-renouvellement tacite,Administratif,Évitez les renouvellements automatiques en négociant une clause de non-renouvellement. Ce conseil est validé par nos experts administratifs.,Professionnels
CO00125,Optez pour une assurance avec protection juridique,Souscription,La protection juridique peut vous aider en cas de litige. Ce conseil est validé par nos experts souscription.,Jeunes conducteurs
CO00126,Évaluez le coût d'une franchise pour chaque type de sinistre,Sinistre,Les franchises varient selon le type de sinistre. Évaluez-les pour mieux choisir. Ce conseil est validé par nos experts sinistres.,Tous
CO00127,Utilisez un dispositif antichoc pour votre pare-brise,Sécurité,Les pare-brises sont vulnérables. Un dispositif antichoc peut les protéger. Ce conseil est validé par nos experts sécurité.,Professionnels
CO00128,Assurez-vous des garanties en cas de vol de documents,Administratif,Le vol de documents peut être problématique. Vérifiez votre couverture. Ce conseil est validé par nos experts administratifs.,Jeunes conducteurs
CO00129,Comparez les primes selon votre région,Économie,Les primes varient selon les régions. Comparez pour trouver la meilleure offre. Ce conseil est validé par nos experts économie.,Seniors
CO00130,Souscrivez une garantie pour les sinistres en parking,Souscription,Les parkings sont des lieux à risque. Une garantie spécifique peut vous couvrir. Ce conseil est validé par nos experts souscription.,Professionnels
CO00131,Vérifiez les exclusions de garantie pour les courses de nuit,Sinistre,Les courses de nuit peuvent être exclues. Vérifiez les conditions de votre contrat. Ce conseil est validé par nos experts sinistres.,Jeunes conducteurs
CO00132,Utilisez des feux de jour pour être mieux visible,Sécurité,Les feux de jour améliorent votre visibilité et réduisent les risques. Ce conseil est validé par nos experts sécurité.,Tous
CO00133,Consultez les conseils de votre assureur pour bien choisir,Administratif,Votre assureur peut vous conseiller sur les options adaptées à votre profil. Ce conseil est validé par nos experts administratifs.,Professionnels
CO00134,Optez pour une assurance avec assistance rapatriement,Souscription,L'assistance rapatriement peut vous aider en cas de panne loin de chez vous. Ce conseil est validé par nos experts souscription.,Jeunes conducteurs
CO00135,Évaluez l'impact des accidents sans tiers sur votre bonus,Économie,Les accidents sans tiers peuvent affecter votre bonus-malus. Ce conseil est validé par nos experts économie.,Seniors
CO00136,Vérifiez les options pour les conducteurs seniors,Souscription,Les conducteurs seniors peuvent bénéficier d'offres adaptées. Renseignez-vous. Ce conseil est validé par nos experts souscription.,Professionnels
CO00137,Utilisez des vidéos de conduite pour vous améliorer,Sécurité,Analyser votre conduite peut vous aider à éviter les accidents. Ce conseil est validé par nos experts sécurité.,Jeunes conducteurs
CO00138,Négociez une réduction pour les conducteurs de plus de 50 ans,Économie,Certains assureurs proposent des réductions pour les conducteurs expérimentés. Ce conseil est validé par nos experts économie.,Tous
CO00139,Conservez vos tickets de stationnement pour justifier vos déplacements,Administratif,Les tickets de stationnement peuvent être utiles en cas de sinistre. Ce conseil est validé par nos experts administratifs.,Professionnels
CO00140,Souscrivez une garantie pour les bris de glace étendue,Souscription,Les bris de glace sont fréquents. Une garantie étendue peut être utile. Ce conseil est validé par nos experts souscription.,Jeunes conducteurs
CO00141,Vérifiez les options de garantie pour les dommages par l'eau,Sinistre,Les dommages par l'eau peuvent être exclus. Vérifiez votre couverture. Ce conseil est validé par nos experts sinistres.,Seniors
CO00142,Utilisez une alarme connectée pour votre véhicule,Sécurité,Une alarme connectée peut alerter en cas d'effraction. Ce conseil est validé par nos experts sécurité.,Professionnels
CO00143,Comparez les offres des assureurs mutualistes,Économie,Les assureurs mutualistes peuvent proposer des offres compétitives. Ce conseil est validé par nos experts économie.,Jeunes conducteurs
CO00144,Assurez-vous que votre contrat est indexé sur l'inflation,Souscription,Un contrat indexé sur l'inflation maintient votre couverture. Ce conseil est validé par nos experts souscription.,Tous
CO00145,Vérifiez les garanties en cas de grève des transports,Administratif,Les grèves peuvent affecter vos déplacements. Vérifiez votre couverture. Ce conseil est validé par nos experts administratifs.,Professionnels
CO00146,Négociez une prime en fonction de votre nombre de sinistres,Économie,Votre historique de sinistres peut influencer votre prime. Négociez-la. Ce conseil est validé par nos experts économie.,Jeunes conducteurs
CO00147,Optez pour une assurance avec couverture des pannes,Souscription,Les pannes peuvent arriver. Une couverture spécifique peut vous aider. Ce conseil est validé par nos experts souscription.,Seniors
CO00148,Utilisez une protection contre le vol de la batterie,Sécurité,La batterie du véhicule peut être volée. Une protection peut être utile. Ce conseil est validé par nos experts sécurité.,Professionnels
CO00149,Consultez les forums de conducteurs pour des conseils,Administratif,Les forums peuvent vous donner des conseils sur les assurances. Ce conseil est validé par nos experts administratifs.,Jeunes conducteurs
CO00150,Souscrivez une garantie pour les dommages aux biens transportés,Souscription,Les biens transportés peuvent être endommagés. Une garantie spécifique peut les protéger. Ce conseil est validé par nos experts souscription.,Tous
CO00151,Vérifiez les options de paiement pour les jeunes conducteurs,Économie,Certains assureurs proposent des paiements adaptés aux jeunes conducteurs. Ce conseil est validé par nos experts économie.,Professionnels
CO00152,Utilisez des pneus adaptés à la saison,Sécurité,Les pneus adaptés réduisent les risques en toutes saisons. Ce conseil est validé par nos experts sécurité.,Jeunes conducteurs
CO00153,Assurez-vous de la prise en charge des frais de dépannage,Souscription,Les frais de dépannage peuvent être élevés. Assurez-vous de leur prise en charge. Ce conseil est validé par nos experts souscription.,Seniors
CO00154,Déclarez tout changement de lieu de résidence,Administratif,Votre lieu de résidence influence votre prime. Déclarez tout changement. Ce conseil est validé par nos experts administratifs.,Professionnels
CO00155,Négociez une remise en cas de souscription en ligne,Économie,Les souscriptions en ligne peuvent bénéficier de remises. Ce conseil est validé par nos experts économie.,Jeunes conducteurs
CO00156,Optez pour une garantie d'assistance 24h/24,Souscription,Une assistance 24h/24 peut vous dépanner à tout moment. Ce conseil est validé par nos experts souscription.,Tous
CO00157,Vérifiez les conditions de résiliation de votre contrat,Sinistre,Les conditions de résiliation peuvent varier. Vérifiez-les avant de signer. Ce conseil est validé par nos experts sinistres.,Professionnels
CO00158,Utilisez un système de verrouillage centralisé,Sécurité,Un verrouillage centralisé protège votre véhicule. Ce conseil est validé par nos experts sécurité.,Jeunes conducteurs
CO00159,Consultez les avis des experts sur votre assureur,Administratif,Les avis des experts peuvent vous aider à choisir. Ce conseil est validé par nos experts administratifs.,Seniors
CO00160,Souscrivez une garantie pour les dommages par le vent,Souscription,Les vents violents peuvent endommager votre véhicule. Une garantie spécifique est utile. Ce conseil est validé par nos experts souscription.,Professionnels
CO00161,Évaluez le coût des réparations en ligne,Économie,Les devis en ligne peuvent vous aider à évaluer le coût des réparations. Ce conseil est validé par nos experts économie.,Jeunes conducteurs
CO00162,Assurez-vous que votre véhicule est équipé de feux de signalisation,Sécurité,Les feux de signalisation sont obligatoires et augmentent votre sécurité. Ce conseil est validé par nos experts sécurité.,Tous
CO00163,Vérifiez les garanties en cas de perte de documents,Souscription,La perte de documents peut être problématique. Vérifiez votre couverture. Ce conseil est validé par nos experts souscription.,Professionnels
CO00164,Négociez une prime en fonction de votre âge,Économie,Votre âge peut influencer votre prime. Négociez pour obtenir le meilleur tarif. Ce conseil est validé par nos experts économie.,Jeunes conducteurs
CO00165,Utilisez des dispositifs anti-recul pour le stationnement,Sécurité,Les dispositifs anti-recul aident à éviter les accidents lors du stationnement. Ce conseil est validé par nos experts sécurité.,Seniors
CO00166,Consultez les guides de l'assurance automobile,Administratif,Les guides peuvent vous aider à comprendre les contrats. Ce conseil est validé par nos experts administratifs.,Professionnels
CO00167,Souscrivez une garantie pour les dommages causés par la foudre,Souscription,La foudre peut endommager votre véhicule. Une garantie spécifique est utile. Ce conseil est validé par nos experts souscription.,Jeunes conducteurs
CO00168,Évaluez le coût des réparations avant de lancer les travaux,Sinistre,Évaluez le coût des réparations pour éviter les mauvaises surprises. Ce conseil est validé par nos experts sinistres.,Tous
CO00169,Utilisez un dispositif anti-volet pour les roues,Sécurité,Les roues peuvent être volées. Un dispositif anti-volet peut les protéger. Ce conseil est validé par nos experts sécurité.,Professionnels
CO00170,Vérifiez les options de garantie pour les dommages par la grêle,Souscription,La grêle peut endommager votre véhicule. Une garantie spécifique est utile. Ce conseil est validé par nos experts souscription.,Jeunes conducteurs
CO00171,Assurez-vous que votre contrat est renouvelé automatiquement,Administratif,Vérifiez les conditions de renouvellement pour éviter les interruptions. Ce conseil est validé par nos experts administratifs.,Seniors
CO00172,Négociez une prime en fonction de votre historique de conduite,Économie,Votre historique de conduite est un atout pour négocier. Ce conseil est validé par nos experts économie.,Professionnels
CO00173,Optez pour une assurance avec assistance morale,Souscription,L'assistance morale peut vous aider après un sinistre. Ce conseil est validé par nos experts souscription.,Jeunes conducteurs
CO00174,Utilisez une protection contre les chocs pour le pare-chocs,Sécurité,Les pare-chocs sont vulnérables aux chocs. Une protection peut les préserver. Ce conseil est validé par nos experts sécurité.,Tous
CO00175,Vérifiez les options de garantie pour les dommages par le gel,Sinistre,Le gel peut endommager votre véhicule. Vérifiez votre couverture. Ce conseil est validé par nos experts sinistres.,Professionnels
CO00176,Consultez les simulateurs de franchise en ligne,Administratif,Les simulateurs peuvent vous aider à choisir votre franchise. Ce conseil est validé par nos experts administratifs.,Jeunes conducteurs
CO00177,Souscrivez une garantie pour les dommages par collision avec un animal,Souscription,Les collisions avec des animaux sont fréquentes. Une garantie spécifique est utile. Ce conseil est validé par nos experts souscription.,Seniors
CO00178,Évaluez le coût d'une assurance tous risques,Économie,Une assurance tous risques offre une couverture complète mais son coût est plus élevé. Ce conseil est validé par nos experts économie.,Professionnels
CO00179,Utilisez une protection contre les intrusions pour le véhicule,Sécurité,Les intrusions peuvent endommager votre véhicule. Une protection peut les prévenir. Ce conseil est validé par nos experts sécurité.,Jeunes conducteurs
CO00180,Vérifiez les exclusions de garantie pour les courses de nuit,Souscription,Les courses de nuit peuvent être exclues. Vérifiez votre contrat. Ce conseil est validé par nos experts souscription.,Tous
CO00181,Assurez-vous que votre véhicule est équipé d'un extincteur,Sécurité,Un extincteur peut être utile en cas d'incendie. Ce conseil est validé par nos experts sécurité.,Professionnels
CO00182,Négociez une prime en fonction de votre lieu de résidence,Économie,Votre lieu de résidence influence votre prime. Négociez pour obtenir le meilleur tarif. Ce conseil est validé par nos experts économie.,Jeunes conducteurs
CO00183,Consultez les garanties optionnelles disponibles,Souscription,Les options peuvent être adaptées à vos besoins. Consultez-les. Ce conseil est validé par nos experts souscription.,Seniors
CO00184,Utilisez un système anti-brouillard pour les feux,Sécurité,Les feux anti-brouillard améliorent la visibilité en conditions difficiles. Ce conseil est validé par nos experts sécurité.,Professionnels
CO00185,Vérifiez les options pour les conducteurs avec un permis récent,Souscription,Les conducteurs avec un permis récent peuvent bénéficier d'offres spécifiques. Ce conseil est validé par nos experts souscription.,Jeunes conducteurs
CO00186,Évaluez le coût des franchises pour chaque type de sinistre,Sinistre,Les franchises varient selon le sinistre. Évaluez-les pour mieux choisir. Ce conseil est validé par nos experts sinistres.,Tous
CO00187,Optez pour une assurance avec assistance pour les longs voyages,Souscription,Les longs voyages peuvent nécessiter une assistance spécifique. Ce conseil est validé par nos experts souscription.,Professionnels
CO00188,Utilisez une protection contre les rayures,Sécurité,Les rayures peuvent dévaloriser votre véhicule. Une protection peut les prévenir. Ce conseil est validé par nos experts sécurité.,Jeunes conducteurs
CO00189,Consultez les avis sur les assureurs en ligne,Administratif,Les avis en ligne peuvent vous aider à choisir votre assureur. Ce conseil est validé par nos experts administratifs.,Seniors
CO00190,Négociez une réduction pour les conducteurs sans sinistre,Économie,Un historique sans sinistre est un atout pour négocier une réduction. Ce conseil est validé par nos experts économie.,Professionnels
CO00191,Souscrivez une garantie pour les dommages par le vent,Économie,Les vents violents peuvent endommager votre véhicule. Une garantie spécifique est utile. Ce conseil est validé par nos experts économie.,Jeunes conducteurs
CO00192,Vérifiez les exclusions de garantie pour les dommages par l'eau,Souscription,Les dommages par l'eau peuvent être exclus. Vérifiez votre contrat. Ce conseil est validé par nos experts souscription.,Tous
CO00193,Utilisez des pneus adaptés à la conduite sur neige,Sécurité,Les pneus adaptés à la neige réduisent les risques d'accident. Ce conseil est validé par nos experts sécurité.,Professionnels
CO00194,Consultez les guides de sécurité routière,Administratif,Les guides de sécurité routière peuvent vous aider à adopter une conduite sûre. Ce conseil est validé par nos experts administratifs.,Jeunes conducteurs
CO00195,Optez pour une assurance avec couverture des frais médicaux,Souscription,Les frais médicaux en cas d'accident peuvent être couverts. Ce conseil est validé par nos experts souscription.,Seniors
CO00196,Évaluez le coût d'une assurance pour les conducteurs occasionnels,Économie,Les conducteurs occasionnels peuvent bénéficier d'assurances adaptées. Ce conseil est validé par nos experts économie.,Professionnels
CO00197,Utilisez une protection contre les vibrations,Sécurité,Les vibrations peuvent endommager votre véhicule. Une protection peut les réduire. Ce conseil est validé par nos experts sécurité.,Jeunes conducteurs
CO00198,Vérifiez les options pour les conducteurs avec des antécédents,Souscription,Les conducteurs avec des antécédents peuvent bénéficier d'offres spécifiques. Ce conseil est validé par nos experts souscription.,Tous
CO00199,Souscrivez une garantie pour les dommages causés par les inondations,Souscription,Les inondations peuvent endommager votre véhicule. Une garantie spécifique est utile. Ce conseil est validé par nos experts souscription.,Professionnels
CO00200,Consultez les options de paiement pour les petits budgets,Économie,Certaines assurances proposent des paiements adaptés aux petits budgets. Ce conseil est validé par nos experts économie.,Jeunes conducteurs
CO00201,Assurez-vous que votre véhicule est équipé d'un système de navigation,Sécurité,Un système de navigation peut vous aider à éviter les zones à risque. Ce conseil est validé par nos experts sécurité.,Seniors
CO00202,Vérifiez les exclusions de garantie pour les dommages causés par la foudre,Souscription,La foudre peut endommager votre véhicule. Vérifiez votre couverture. Ce conseil est validé par nos experts souscription.,Professionnels
CO00203,Utilisez une protection contre le vol pour les autoradios,Sécurité,Les autoradios sont souvent volés. Une protection peut les sécuriser. Ce conseil est validé par nos experts sécurité.,Jeunes conducteurs
CO00204,Consultez les simulateurs de prime pour estimer votre coût,Administratif,Les simulateurs vous permettent d'estimer votre prime avant de souscrire. Ce conseil est validé par nos experts administratifs.,Tous
CO00205,Négociez une prime en fonction de votre métier,Économie,Votre métier peut influencer votre prime. Négociez pour obtenir le meilleur tarif. Ce conseil est validé par nos experts économie.,Professionnels
CO00206,Souscrivez une garantie pour les dommages par la grêle,Souscription,La grêle peut endommager votre véhicule. Une garantie spécifique est utile. Ce conseil est validé par nos experts souscription.,Jeunes conducteurs
CO00207,Vérifiez les options pour les conducteurs avec un permis probatoire,Souscription,Les conducteurs avec un permis probatoire peuvent bénéficier d'offres adaptées. Ce conseil est validé par nos experts souscription.,Seniors
CO00208,Évaluez le coût des réparations en cas de sinistre,Sinistre,Évaluez le coût des réparations pour éviter les mauvaises surprises. Ce conseil est validé par nos experts sinistres.,Professionnels
CO00209,Utilisez une protection contre les chocs pour le pare-chocs,Sécurité,Les pare-chocs sont vulnérables aux chocs. Une protection peut les préserver. Ce conseil est validé par nos experts sécurité.,Jeunes conducteurs
CO00210,Consultez les garanties optionnelles en ligne,Administratif,Les options disponibles en ligne peuvent être comparées facilement. Ce conseil est validé par nos experts administratifs.,Tous
CO00211,Négociez une prime en fonction de votre lieu de stationnement,Économie,Le lieu de stationnement influence votre prime. Négociez pour obtenir le meilleur tarif. Ce conseil est validé par nos experts économie.,Professionnels
CO00212,Souscrivez une garantie pour les dommages par le gel,Souscription,Le gel peut endommager votre véhicule. Une garantie spécifique est utile. Ce conseil est validé par nos experts souscription.,Jeunes conducteurs
CO00213,Vérifiez les exclusions de garantie pour les courses de nuit,Souscription,Les courses de nuit peuvent être exclues. Vérifiez votre contrat. Ce conseil est validé par nos experts souscription.,Seniors
CO00214,Assurez-vous que votre véhicule est équipé d'un système de sécurité,Sécurité,Un système de sécurité peut protéger votre véhicule. Ce conseil est validé par nos experts sécurité.,Professionnels
CO00215,Consultez les simulateurs de franchise en ligne,Économie,Les simulateurs peuvent vous aider à choisir votre franchise. Ce conseil est validé par nos experts économie.,Jeunes conducteurs
CO00216,Optez pour une assurance avec assistance psychologique,Souscription,L'assistance psychologique peut vous aider après un sinistre. Ce conseil est validé par nos experts souscription.,Tous
CO00217,Vérifiez les options pour les conducteurs avec des enfants,Souscription,Les conducteurs avec des enfants peuvent bénéficier d'offres spécifiques. Ce conseil est validé par nos experts souscription.,Professionnels
CO00218,Utilisez une protection contre les intrusions,Sécurité,Les intrusions peuvent endommager votre véhicule. Une protection peut les prévenir. Ce conseil est validé par nos experts sécurité.,Jeunes conducteurs
CO00219,Évaluez le coût d'une assurance tous risques,Administratif,Une assurance tous risques offre une couverture complète mais son coût est plus élevé. Ce conseil est validé par nos experts administratifs.,Seniors
CO00220,Souscrivez une garantie pour les dommages par le feu,Souscription,Le feu peut endommager votre véhicule. Une garantie spécifique est utile. Ce conseil est validé par nos experts souscription.,Professionnels
CO00221,Vérifiez les exclusions de garantie pour les dommages par l'eau,Souscription,Les dommages par l'eau peuvent être exclus. Vérifiez votre contrat. Ce conseil est validé par nos experts souscription.,Jeunes conducteurs
CO00222,Assurez-vous que votre véhicule est équipé de feux de signalisation,Sécurité,Les feux de signalisation sont obligatoires et augmentent votre sécurité. Ce conseil est validé par nos experts sécurité.,Tous
CO00223,Consultez les simulateurs de prime en ligne,Administratif,Les simulateurs en ligne vous permettent d'estimer votre prime avant de souscrire. Ce conseil est validé par nos experts administratifs