ConseilID,Titre,Categorie,Contenu,Public
CO00001,Déclarez tous les conducteurs habituels du véhicule,Administratif,Déclarez tous les conducteurs habituels du véhicule. Ce conseil est validé par nos experts underwriting.,Jeunes conducteurs
CO00002,Installez un antivol agréé pour réduire le risque vol,Sinistre,Installez un antivol agréé pour réduire le risque vol. Ce conseil est validé par nos experts underwriting.,Professionnels
CO00003,Garez votre véhicule en garage fermé si possible,Administratif,Garez votre véhicule en garage fermé si possible. Ce conseil est validé par nos experts underwriting.,Jeunes conducteurs
CO00004,Mettez à jour votre kilométrage annuel chaque année,Souscription,Mettez à jour votre kilométrage annuel chaque année. Ce conseil est validé par nos experts underwriting.,Jeunes conducteurs
CO00005,Conservez vos preuves d'entretien régulier,Administratif,Conservez vos preuves d'entretien régulier. Ce conseil est validé par nos experts underwriting.,Jeunes conducteurs
CO00006,Signalez immédiatement tout changement d'adresse,Souscription,Signalez immédiatement tout changement d'adresse. Ce conseil est validé par nos experts underwriting.,Professionnels
CO00007,Profitez des réductions multi-véhicules et fidélité,Sinistre,Profitez des réductions multi-véhicules et fidélité. Ce conseil est validé par nos experts underwriting.,Jeunes conducteurs
CO00008,Vérifiez les exclusions avant chaque renouvellement,Souscription,Vérifiez les exclusions avant chaque renouvellement. Ce conseil est validé par nos experts underwriting.,Professionnels
CO00009,Utilisez l'application mobile pour suivre vos sinistres,Sinistre,Utilisez l'application mobile pour suivre vos sinistres. Ce conseil est validé par nos experts underwriting.,Jeunes conducteurs
CO00010,Comparez les franchises avant de choisir votre formule,Sinistre,Comparez les franchises avant de choisir votre formule. Ce conseil est validé par nos experts underwriting.,Jeunes conducteurs
CO00011,Vérifiez l'historique de vos conducteurs avant la souscription,Souscription,Consultez l'historique des sinistres de tous les conducteurs avant de souscrire un nouveau contrat. Ce conseil est validé par nos experts souscription.,Seniors
CO00012,Évaluez la valeur réelle de votre véhicule chaque année,Administratif,Faites estimer la valeur de votre véhicule chaque année pour ajuster votre prime d'assurance. Ce conseil est validé par nos experts souscription.,Professionnels
CO00013,Comparez les garanties options avant de signer,Souscription,Étudiez les garanties optionnelles proposées et choisissez celles qui correspondent à votre usage. Ce conseil est validé par nos experts souscription.,Jeunes conducteurs
CO00014,Négociez votre franchise selon votre profil de conduite,Sinistre,Adaptez le montant de votre franchise en fonction de votre historique de conduite et de votre véhicule. Ce conseil est validé par nos experts sinistres.,Seniors
CO00015,Utilisez un système de géolocalisation pour réduire les risques,Sécurité,Installez un dispositif de géolocalisation qui peut aider à retrouver votre véhicule en cas de vol. Ce conseil est validé par nos experts sécurité.,Tous
CO00016,Souscrivez une protection juridique adaptée,Souscription,La protection juridique peut vous couvrir en cas de litige lié à un accident ou un sinistre. Ce conseil est validé par nos experts souscription.,Professionnels
CO00017,Conservez tous les justificatifs d'entretien du véhicule,Administratif,Gardez précieusement vos factures d'entretien pour prouver le bon état de votre véhicule. Ce conseil est validé par nos experts administratifs.,Jeunes conducteurs
CO00018,Optez pour le paiement annuel pour faire des économies,Économie,Le paiement annuel de votre prime est souvent moins cher que les mensualités. Ce conseil est validé par nos experts économie.,Professionnels
CO00019,Soyez attentif aux franchises en cas de sinistre multiple,Sinistre,En cas de sinistres répétés, vérifiez l'impact sur vos franchises et votre bonus-malus. Ce conseil est validé par nos experts sinistres.,Jeunes conducteurs
CO00020,Déclarez rapidement tout changement de situation personnelle,Administratif,Un mariage, un divorce ou un déménagement peut influencer votre contrat d'assurance. Ce conseil est validé par nos experts administratifs.,Seniors
CO00021,Utilisez un comparateur avant chaque renouvellement,Économie,Comparez les offres du marché chaque année avant de renouveler votre contrat. Ce conseil est validé par nos experts économie.,Jeunes conducteurs
CO00022,Formez-vous aux gestes de premiers secours routiers,Sécurité,Suivre une formation aux premiers secours peut vous aider en cas d'accident. Ce conseil est validé par nos experts sécurité.,Professionnels
CO00023,Vérifiez la conformité des pneus et des feux du véhicule,Administratif,Un véhicule en bon état est moins sujet aux accidents. Vérifiez régulièrement vos pneus et vos feux. Ce conseil est validé par nos experts administratifs.,Tous
CO00024,N'oubliez pas d'assurer les accessoires du véhicule,Souscription,Les accessoires comme les jantes, le toit ouvrant ou la galerie doivent être déclarés. Ce conseil est validé par nos experts souscription.,Jeunes conducteurs
CO00025,Utilisez votre application assurance pour déclarer un sinistre,Sinistre,La déclaration de sinistre via l'application est rapide et permet de suivre votre dossier en temps réel. Ce conseil est validé par nos experts sinistres.,Seniors
CO00026,Choisissez une garantie bris de glace adaptée à votre région,Souscription,Les régions à forte circulation ou zones côtières nécessitent une garantie bris de glace renforcée. Ce conseil est validé par nos experts souscription.,Professionnels
CO00027,Réduisez votre prime en augmentant votre franchise,Économie,Accepter une franchise plus élevée réduit votre prime mensuelle. Évaluez votre capacité à payer cette franchise. Ce conseil est validé par nos experts économie.,Jeunes conducteurs
CO00028,Stockez votre véhicule dans un lieu sécurisé,Sécurité,Un parking fermé ou un garage diminue les risques de vol et de dégradation. Ce conseil est validé par nos experts sécurité.,Tous
CO00029,Anticipez les coûts d'une réparation après sinistre,Sinistre,Demandez plusieurs devis avant de lancer une réparation pour évaluer le coût total. Ce conseil est validé par nos experts sinistres.,Professionnels
CO00030,Utilisez la conduite accompagnée pour réduire vos primes,Administratif,La conduite accompagnée permet de réduire le risque et d'obtenir des primes plus basses. Ce conseil est validé par nos experts administratifs.,Jeunes conducteurs
CO00031,Vérifiez les exclusions de garantie pour les dommages électriques,Souscription,Certains contrats excluent les dommages électriques. Assurez-vous d'être bien couvert. Ce conseil est validé par nos experts souscription.,Seniors
CO00032,Optez pour un forfait kilométrique adapté à vos déplacements,Économie,Un forfait kilométrique trop élevé ou trop bas vous coûte inutilement. Ajustez-le chaque année. Ce conseil est validé par nos experts économie.,Professionnels
CO00033,Effectuez un entretien régulier du système de freinage,Sécurité,Un système de freinage en bon état est essentiel pour éviter les accidents. Ce conseil est validé par nos experts sécurité.,Jeunes conducteurs
CO00034,Assurez-vous de la validité de votre carte grise,Administratif,Une carte grise périmée peut entraîner des problèmes en cas de sinistre. Ce conseil est validé par nos experts administratifs.,Tous
CO00035,Utilisez les aides à la conduite connectées,Sécurité,Les dispositifs connectés peuvent vous aider à adopter une conduite plus sûre. Ce conseil est validé par nos experts sécurité.,Professionnels
CO00036,Renseignez-vous sur les garanties assistance 24/7,Souscription,L'assistance 24/7 peut vous dépanner en cas de panne ou d'accident. Ce conseil est validé par nos experts souscription.,Jeunes conducteurs
CO00037,Comparez les tarifs des assureurs en ligne,Économie,Les assureurs en ligne proposent souvent des tarifs plus compétitifs. Ce conseil est validé par nos experts économie.,Seniors
CO00038,Suivez l'évolution de votre bonus-malus chaque année,Administratif,Surveillez votre coefficient de bonus-malus pour anticiper vos futures primes. Ce conseil est validé par nos experts administratifs.,Tous
CO00039,Protégez vos biens personnels dans le véhicule,Sécurité,N'oubliez pas d'assurer les objets personnels laissés dans le véhicule. Ce conseil est validé par nos experts sécurité.,Professionnels
CO00040,Souscrivez une garantie vol avec extension à l'étranger,Souscription,Si vous voyagez, assurez-vous que votre garantie vol couvre également l'étranger. Ce conseil est validé par nos experts souscription.,Jeunes conducteurs
CO00041,Utilisez un système d'alerte en cas d'effraction,Sécurité,Un système d'alarme dissuasif peut réduire le risque de vol. Ce conseil est validé par nos experts sécurité.,Seniors
CO00042,Évaluez l'impact de la région sur votre prime,Économie,Votre lieu de résidence influence le montant de votre prime. Informez-vous sur les zones à risque. Ce conseil est validé par nos experts économie.,Professionnels
CO00043,Conservez vos factures de réparation après un sinistre,Administratif,Les factures de réparation peuvent être utiles pour prouver la valeur du véhicule. Ce conseil est validé par nos experts administratifs.,Jeunes conducteurs
CO00044,Faites vérifier votre véhicule après un sinistre mineur,Sinistre,Même un petit sinistre peut avoir des conséquences sur la mécanique. Faites vérifier votre véhicule. Ce conseil est validé par nos experts sinistres.,Tous
CO00045,Négociez une réduction pour conducteurs expérimentés,Souscription,Les assureurs peuvent proposer des réductions pour les conducteurs avec un long historique sans sinistre. Ce conseil est validé par nos experts souscription.,Professionnels
CO00046,Utilisez les bornes de recharge pour véhicules électriques,Sécurité,Un véhicule électrique nécessite des précautions particulières pour la recharge. Ce conseil est validé par nos experts sécurité.,Jeunes conducteurs
CO00047,Déclarez toutes les modifications apportées au véhicule,Administratif,Toute modification technique doit être déclarée à votre assureur. Ce conseil est validé par nos experts administratifs.,Seniors
CO00048,Choisissez une assurance adaptée à votre usage professionnel,Souscription,Si vous utilisez votre véhicule pour le travail, optez pour une assurance professionnelle. Ce conseil est validé par nos experts souscription.,Tous
CO00049,Surveillez la pression des pneus régulièrement,Sécurité,Des pneus bien gonflés améliorent l'adhérence et réduisent les risques d'accident. Ce conseil est validé par nos experts sécurité.,Professionnels
CO00050,Optez pour une franchise dégressive en l'absence de sinistre,Sinistre,Certains contrats proposent une franchise dégressive qui diminue en cas de bonne conduite. Ce conseil est validé par nos experts sinistres.,Jeunes conducteurs
CO00051,Utilisez un service de covoiturage pour réduire vos trajets,Économie,Réduire vos kilomètres annuels peut diminuer votre prime d'assurance. Ce conseil est validé par nos experts économie.,Seniors
CO00052,Vérifiez les options d'assistance psychologique après sinistre,Souscription,Un sinistre peut avoir des conséquences psychologiques. Renseignez-vous sur les options d'assistance. Ce conseil est validé par nos experts souscription.,Professionnels
CO00053,Assurez-vous de la validité du contrôle technique,Administratif,Un contrôle technique valide est obligatoire pour votre assurance. Ce conseil est validé par nos experts administratifs.,Jeunes conducteurs
CO00054,Comparez les offres de garantie protection du conducteur,Souscription,La protection du conducteur est souvent négligée. Comparez les offres disponibles. Ce conseil est validé par nos experts souscription.,Tous
CO00055,N'oubliez pas d'assurer les vitres et les optiques,Sinistre,Les vitres et les optiques sont vulnérables. Une garantie spécifique peut être utile. Ce conseil est validé par nos experts sinistres.,Professionnels
CO00056,Évaluez le coût d'une franchise élevée en cas de sinistre,Sinistre,Une franchise élevée peut vous faire économiser mais peut être coûteuse en cas de sinistre. Ce conseil est validé par nos experts sinistres.,Jeunes conducteurs
CO00057,Utilisez une application pour suivre votre conduite,Sécurité,Certaines applications analysent votre conduite et peuvent réduire votre prime. Ce conseil est validé par nos experts sécurité.,Seniors
CO00058,Assurez-vous de la couverture en cas de catastrophe naturelle,Souscription,Les catastrophes naturelles peuvent endommager votre véhicule. Vérifiez votre couverture. Ce conseil est validé par nos experts souscription.,Professionnels
CO00059,Gardez une trace de vos déplacements professionnels,Administratif,En cas de sinistre, la traçabilité de vos déplacements peut vous être utile. Ce conseil est validé par nos experts administratifs.,Jeunes conducteurs
CO00060,Souscrivez une garantie pour les dommages causés par les animaux,Sinistre,Les collisions avec des animaux sont fréquentes. Une garantie spécifique peut vous couvrir. Ce conseil est validé par nos experts sinistres.,Tous
CO00061,Optez pour une assurance avec remboursement du véhicule neuf,Souscription,En cas de sinistre, une assurance remboursant la valeur à neuf peut être avantageuse. Ce conseil est validé par nos experts souscription.,Professionnels
CO00062,Vérifiez les options de réduction pour les bons conducteurs,Économie,Les conducteurs ayant un bon historique peuvent bénéficier de réductions. Ce conseil est validé par nos experts économie.,Jeunes conducteurs
CO00063,Protégez votre véhicule contre le vandalisme,Sécurité,Le vandalisme peut arriver. Une garantie spécifique peut vous protéger. Ce conseil est validé par nos experts sécurité.,Seniors
CO00064,Utilisez un garage agréé pour vos réparations,Sinistre,Un garage agréé par votre assureur garantit des réparations de qualité. Ce conseil est validé par nos experts sinistres.,Professionnels
CO00065,Déclarez tout sinistre même mineur à votre assureur,Administratif,Même un petit sinistre doit être déclaré pour éviter des complications ultérieures. Ce conseil est validé par nos experts administratifs.,Jeunes conducteurs
CO00066,Assurez-vous d'être couvert en cas de sinistre à l'étranger,Souscription,Vérifiez que votre assurance vous couvre également à l'étranger. Ce conseil est validé par nos experts souscription.,Tous
CO00067,Optez pour une franchise personnalisée selon votre budget,Économie,Adaptez le montant de votre franchise à votre capacité financière. Ce conseil est validé par nos experts économie.,Professionnels
CO00068,Suivez les recommandations de sécurité de votre assureur,Sécurité,Les assureurs proposent souvent des recommandations pour réduire les risques. Ce conseil est validé par nos experts sécurité.,Jeunes conducteurs
CO00069,Vérifiez les garanties en cas de sinistre corporel,Sinistre,Les sinistres corporels ont des conséquences graves. Assurez-vous d'être bien couvert. Ce conseil est validé par nos experts sinistres.,Seniors
CO00070,Consultez votre assureur avant d'acheter un véhicule neuf,Souscription,Avant d'acheter un véhicule, demandez un devis à votre assureur. Ce conseil est validé par nos experts souscription.,Professionnels
CO00071,Utilisez les transports en commun pour réduire vos trajets,Économie,Moins de trajets signifie moins de risques et une prime plus faible. Ce conseil est validé par nos experts économie.,Jeunes conducteurs
CO00072,Vérifiez la date de validité de votre permis de conduire,Administratif,Un permis valide est indispensable pour être couvert en cas de sinistre. Ce conseil est validé par nos experts administratifs.,Tous
CO00073,Installez des pneus hiver en région montagneuse,Sécurité,Les pneus hiver sont obligatoires dans certaines zones et réduisent les risques. Ce conseil est validé par nos experts sécurité.,Professionnels
CO00074,Négociez votre prime en fonction de votre historique,Économie,Votre historique de conduite sans sinistre est un argument pour négocier votre prime. Ce conseil est validé par nos experts économie.,Jeunes conducteurs
CO00075,Assurez-vous de la couverture en cas de panne,Souscription,La panne peut arriver. Vérifiez que votre assurance inclut une assistance panne. Ce conseil est validé par nos experts souscription.,Seniors
CO00076,Utilisez les systèmes d'aide à la conduite,Sécurité,Les systèmes d'aide à la conduite comme l'ABS ou l'ESP réduisent les risques d'accident. Ce conseil est validé par nos experts sécurité.,Professionnels
CO00077,Vérifiez les garanties pour les dommages causés aux tiers,Souscription,La garantie responsabilité civile est obligatoire mais vérifiez son montant maximal. Ce conseil est validé par nos experts souscription.,Jeunes conducteurs
CO00078,Comparez les offres d'assurance tous les 2 ans,Économie,Les offres évoluent rapidement. Comparez régulièrement pour trouver la meilleure offre. Ce conseil est validé par nos experts économie.,Tous
CO00079,Stockez le véhicule dans un endroit éclairé la nuit,Sécurité,Un véhicule stationné dans un endroit bien éclairé est moins vulnérable. Ce conseil est validé par nos experts sécurité.,Professionnels
CO00080,Déclarez tout changement de situation professionnelle,Administratif,Un changement de métier peut influencer votre usage du véhicule et votre prime. Ce conseil est validé par nos experts administratifs.,Jeunes conducteurs
CO00081,Optez pour une garantie contre le vol des accessoires,Souscription,Les accessoires comme les roues ou les systèmes audio peuvent être volés. Ce conseil est validé par nos experts souscription.,Seniors
CO00082,Utilisez un simulateur de prime en ligne,Économie,Les simulateurs en ligne vous permettent d'estimer votre prime avant de souscrire. Ce conseil est validé par nos experts économie.,Professionnels
CO00083,Vérifiez l'état des essuie-glaces et des phares,Sécurité,Des essuie-glaces et des phares en bon état améliorent votre visibilité. Ce conseil est validé par nos experts sécurité.,Jeunes conducteurs
CO00084,Conservez les documents du véhicule dans un endroit sûr,Administratif,La carte grise et le certificat d'assurance doivent être facilement accessibles. Ce conseil est validé par nos experts administratifs.,Tous
CO00085,Souscrivez une assurance pour les déplacements professionnels,Souscription,Si vous utilisez votre véhicule pour le travail, vérifiez votre couverture. Ce conseil est validé par nos experts souscription.,Professionnels
CO00086,Évaluez votre kilométrage annuel réel,Économie,Un kilométrage surestimé ou sous-estimé peut vous coûter cher. Ce conseil est validé par nos experts économie.,Jeunes conducteurs
CO00087,Utilisez un antivol de qualité pour votre véhicule,Sécurité,Un antivol certifié est plus efficace contre le vol. Ce conseil est validé par nos experts sécurité.,Seniors
CO00088,Assurez-vous de la prise en charge des frais d'expertise,Sinistre,Les frais d'expertise peuvent être élevés. Vérifiez qu'ils sont pris en charge. Ce conseil est validé par nos experts sinistres.,Professionnels
CO00089,Vérifiez les options pour les jeunes conducteurs,Souscription,Les jeunes conducteurs peuvent bénéficier de formations ou de dispositifs spécifiques. Ce conseil est validé par nos experts souscription.,Jeunes conducteurs
CO00090,Réduisez votre prime en limitant les déplacements nocturnes,Économie,Les trajets nocturnes sont plus risqués. Limitez-les pour réduire votre prime. Ce conseil est validé par nos experts économie.,Tous
CO00091,Entretenez régulièrement votre système de climatisation,Sécurité,Un système de climatisation en bon état évite les problèmes en été. Ce conseil est validé par nos experts sécurité.,Professionnels
CO00092,Consultez les avis des autres assurés sur votre assureur,Administratif,Les avis des autres assurés peuvent vous éclairer sur la qualité du service. Ce conseil est validé par nos experts administratifs.,Jeunes conducteurs
CO00093,Négociez une clause de valeur à neuf pour votre véhicule,Souscription,La valeur à neuf peut être un atout en cas de sinistre total. Ce conseil est validé par nos experts souscription.,Seniors
CO00094,Utilisez un véhicule de remplacement en cas de sinistre,Sinistre,La garantie véhicule de remplacement vous permet de continuer vos déplacements. Ce conseil est validé par nos experts sinistres.,Professionnels
CO00095,Surveillez les alertes de rappel de constructeur,Administratif,Les rappels de constructeur peuvent concerner la sécurité de votre véhicule. Ce conseil est validé par nos experts administratifs.,Jeunes conducteurs
CO00096,Optez pour une assurance avec assistance administrative,Souscription,L'assistance administrative peut vous aider en cas de perte de documents. Ce conseil est validé par nos experts souscription.,Tous
CO00097,Réduisez votre prime en conduisant de manière éco-responsable,Économie,Une conduite éco-responsable réduit les risques et votre prime. Ce conseil est validé par nos experts économie.,Professionnels
CO00098,Assurez-vous que votre véhicule est conforme aux normes,Sécurité,Un véhicule non conforme peut vous mettre en danger et vous faire perdre votre couverture. Ce conseil est validé par nos experts sécurité.,Jeunes conducteurs
CO00099,Vérifiez les délais de déclaration des sinistres,Sinistre,Respectez les délais de déclaration pour éviter les refus de prise en charge. Ce conseil est validé par nos experts sinistres.,Seniors
CO00100,Comparez les garanties optionnelles avec votre conseiller,Souscription,Les options peuvent être ajustées selon vos besoins. Discutez-en avec votre conseiller. Ce conseil est validé par nos experts souscription.,Professionnels
CO00101,Utilisez les transports alternatifs pour réduire l'usure,Économie,Moins de kilomètres signifie moins d'usure et une prime plus basse. Ce conseil est validé par nos experts économie.,Jeunes conducteurs
CO00102,Vérifiez la conformité des dispositifs de sécurité,Sécurité,Les dispositifs de sécurité comme les airbags doivent être fonctionnels. Ce conseil est validé par nos experts sécurité.,Tous
CO00103,Déclarez toutes les personnes conduisant régulièrement,Administratif,Tous les conducteurs réguliers doivent être déclarés pour une couverture complète. Ce conseil est validé par nos experts administratifs.,Professionnels
CO00104,Souscrivez une garantie pour les événements climatiques,Souscription,Les événements climatiques extrêmes peuvent endommager votre véhicule. Ce conseil est validé par nos experts souscription.,Jeunes conducteurs
CO00105,Renseignez-vous sur les aides gouvernementales pour jeunes conducteurs,Économie,Des aides peuvent exister pour les jeunes conducteurs. Renseignez-vous. Ce conseil est validé par nos experts économie.,Seniors
CO00106,Vérifiez les exclusions de garantie pour les courses,Sinistre,Certains contrats excluent les dommages pendant les courses. Vérifiez les conditions. Ce conseil est validé par nos experts sinistres.,Professionnels
CO00107,Utilisez une dashcam pour prouver votre bonne foi,Sécurité,Les dashcams peuvent être utiles en cas d'accident litigieux. Ce conseil est validé par nos experts sécurité.,Jeunes conducteurs
CO00108,Consultez votre assureur avant un long voyage,Souscription,Avant un long voyage, vérifiez que votre couverture est adaptée. Ce conseil est validé par nos experts souscription.,Tous
CO00109,Évaluez le coût des réparations avant de lancer les travaux,Sinistre,Demandez plusieurs devis pour évaluer le coût des réparations. Ce conseil est validé par nos experts sinistres.,Professionnels
CO00110,Surveillez les changements de réglementation automobile,Administratif,Les lois évoluent. Assurez-vous que votre assurance est toujours conforme. Ce conseil est validé par nos experts administratifs.,Jeunes conducteurs
CO00111,Négociez une réduction pour l'absence de sinistre,Économie,Un historique sans sinistre est un atout pour négocier votre prime. Ce conseil est validé par nos experts économie.,Seniors
CO00112,Optez pour une garantie qui couvre les frais de dépannage,Souscription,Les frais de dépannage peuvent être élevés. Une garantie spécifique peut les couvrir. Ce conseil est validé par nos experts souscription.,Professionnels
CO00113,Assurez-vous de la qualité des pièces de rechange utilisées,Sinistre,Les pièces de rechange doivent être de qualité pour garantir votre sécurité. Ce conseil est validé par nos experts sinistres.,Jeunes conducteurs
CO00114,Utilisez des applications de mobilité pour éviter le trafic,Sécurité,Éviter le trafic réduit les risques d'accident. Utilisez des applications de mobilité. Ce conseil est validé par nos experts sécurité.,Tous
CO00115,Vérifiez les garanties en cas de dommage par le feu,Souscription,Les dommages par le feu peuvent être exclus. Vérifiez votre couverture. Ce conseil est validé par nos experts souscription.,Professionnels
CO00116,Comparez les offres d'assurance pour les véhicules anciens,Économie,Les véhicules anciens peuvent bénéficier d'assurances spécifiques. Comparez les offres. Ce conseil est validé par nos experts économie.,Jeunes conducteurs
